<?xml version="1.0" encoding="UTF-8" ?>
<?xml-stylesheet type="text/css" href="zoo.css"?>
  <z:zoo
    xmlns:xsd="http://www.w3.org/2001/XMLSchema-instance"
    xsd:schemaLocation="http://www.XMLTechnologies.org/zoo zoo.xsd"
    xmlns:z="http://www.XMLTechnologies.org/zoo" >

    <z:header>
      <z:autor>Autorem dokumentu jest Krzysztof Deka</z:autor>
      <z:nrIndeksu>242377</z:nrIndeksu>
      <z:dataModyfikacji>2022-11-07</z:dataModyfikacji>
    </z:header>
    <z:zwierzeta>

      <z:zwierze idG="01" idWybiegu="W01" class="1">
        <z:nazwaZwierzecia >Słoń</z:nazwaZwierzecia> <!--nazwa może zawierać 40 znaków  -->
        <z:imie >Stefan</z:imie><!--Imie zaczyna się wielką literą i może zaiwerać max 15 znaków-->
        <z:wiek>22</z:wiek><!-- liczba całkowita -->
        <z:waga jednostka="kg">500.0</z:waga><!--liczba zmiennoprzecinowa. Reprezentacja w jednostce kg -->
        <z:zdjecie src="./Photos/Animals/Stefan" format="JPEG"/><!--zdjęcie musi byc zapisane pod podaną ścieżką w formacie JPEG-->
        <z:dataUrodzenia>12.05.2000</z:dataUrodzenia><!-- data w formacie dd.mm.yyyy-->
      </z:zwierze>

      <z:zwierze idG="01" idWybiegu="W02" class="2">
        <z:nazwaZwierzecia >Wydra</z:nazwaZwierzecia> <!--nazwa może zawierać 40 znaków  -->
        <z:imie >Zosia</z:imie><!--Imie zaczyna się wielką literą i może zaiwerać max 15 znaków-->
        <z:wiek>15</z:wiek><!-- liczba całkowita -->
        <z:waga jednostka="kg">20.0</z:waga><!--liczba zmiennoprzecinowa. Reprezentacja w jednostce kg -->
        <z:zdjecie src="./Photos/Animals/Stefan" format="JPEG"/><!--zdjęcie musi byc zapisane pod podaną ścieżką w formacie JPEG-->
        <z:dataUrodzenia>12.05.2007</z:dataUrodzenia><!-- data w formacie dd.mm.yyyy-->
      </z:zwierze>
      <z:zwierze idG="01" idWybiegu="W03" class="3">
        <z:nazwaZwierzecia >Pingwin</z:nazwaZwierzecia> <!--nazwa może zawierać 40 znaków  -->
        <z:imie >Kowalski</z:imie><!--Imie zaczyna się wielką literą i może zaiwerać max 15 znaków-->
        <z:wiek>2</z:wiek><!-- liczba całkowita -->
        <z:waga jednostka="kg">75.0</z:waga><!--liczba zmiennoprzecinowa. Reprezentacja w jednostce kg -->
        <z:zdjecie src="./Photos/Animals/Stefan" format="JPEG"/><!--zdjęcie musi byc zapisane pod podaną ścieżką w formacie JPEG-->
        <z:dataUrodzenia>13.04.2020</z:dataUrodzenia><!-- data w formacie dd.mm.yyyy-->
      </z:zwierze>
      <z:zwierze idG="01" idWybiegu="W04" class="4">
        <z:nazwaZwierzecia >Żyrafa</z:nazwaZwierzecia> <!--nazwa może zawierać 40 znaków  -->
        <z:imie >Agata</z:imie><!--Imie zaczyna się wielką literą i może zaiwerać max 15 znaków-->
        <z:wiek>5</z:wiek><!-- liczba całkowita -->
        <z:waga jednostka="kg">450.0</z:waga><!--liczba zmiennoprzecinowa. Reprezentacja w jednostce kg -->
        <z:zdjecie src="./Photos/Animals/Stefan" format="JPEG"/><!--zdjęcie musi byc zapisane pod podaną ścieżką w formacie JPEG-->
        <z:dataUrodzenia>01.06.2017</z:dataUrodzenia><!-- data w formacie dd.mm.yyyy-->
      </z:zwierze>
      <z:zwierze idG="04" idWybiegu="W05" class="1">
        <z:nazwaZwierzecia >Płaszczka</z:nazwaZwierzecia> <!--nazwa może zawierać 40 znaków  -->
        <z:imie >Cecylia</z:imie><!--Imie zaczyna się wielką literą i może zaiwerać max 15 znaków-->
        <z:wiek>16</z:wiek><!-- liczba całkowita -->
        <z:waga jednostka="kg">200.0</z:waga><!--liczba zmiennoprzecinowa. Reprezentacja w jednostce kg -->
        <z:zdjecie src="./Photos/Animals/Stefan" format="JPEG"/><!--zdjęcie musi byc zapisane pod podaną ścieżką w formacie JPEG-->
        <z:dataUrodzenia>19.12.2006</z:dataUrodzenia><!-- data w formacie dd.mm.yyyy-->
      </z:zwierze>
      <z:zwierze idG="01" idWybiegu="W06" class="2">
        <z:nazwaZwierzecia >Koń</z:nazwaZwierzecia> <!--nazwa może zawierać 40 znaków  -->
        <z:imie >Adrian</z:imie><!--Imie zaczyna się wielką literą i może zaiwerać max 15 znaków-->
        <z:wiek>1</z:wiek><!-- liczba całkowita -->
        <z:waga jednostka="kg">500.0</z:waga><!--liczba zmiennoprzecinowa. Reprezentacja w jednostce kg -->
        <z:zdjecie src="./Photos/Animals/Stefan" format="JPEG"/><!--zdjęcie musi byc zapisane pod podaną ścieżką w formacie JPEG-->
        <z:dataUrodzenia>01,01.2021</z:dataUrodzenia><!-- data w formacie dd.mm.yyyy-->
      </z:zwierze>
      <z:zwierze idG="02" idWybiegu="W07" class="3">
        <z:nazwaZwierzecia >Salamandra</z:nazwaZwierzecia> <!--nazwa może zawierać 40 znaków  -->
        <z:imie >Weri</z:imie><!--Imie zaczyna się wielką literą i może zaiwerać max 15 znaków-->
        <z:wiek>2</z:wiek><!-- liczba całkowita -->
        <z:waga jednostka="kg">0.2</z:waga><!--liczba zmiennoprzecinowa. Reprezentacja w jednostce kg -->
        <z:zdjecie src="./Photos/Animals/Stefan" format="JPEG"/><!--zdjęcie musi byc zapisane pod podaną ścieżką w formacie JPEG-->
        <z:dataUrodzenia>17.07.2020</z:dataUrodzenia><!-- data w formacie dd.mm.yyyy-->
      </z:zwierze>
      <z:zwierze idG="03" idWybiegu="W08" class="4">
        <z:nazwaZwierzecia >Żaba</z:nazwaZwierzecia> <!--nazwa może zawierać 40 znaków  -->
        <z:imie >Lucy</z:imie><!--Imie zaczyna się wielką literą i może zaiwerać max 15 znaków-->
        <z:wiek>3</z:wiek><!-- liczba całkowita -->
        <z:waga jednostka="kg">0.1</z:waga><!--liczba zmiennoprzecinowa. Reprezentacja w jednostce kg -->
        <z:zdjecie src="./Photos/Animals/Stefan" format="JPEG"/><!--zdjęcie musi byc zapisane pod podaną ścieżką w formacie JPEG-->
        <z:dataUrodzenia>12.05.2019</z:dataUrodzenia><!-- data w formacie dd.mm.yyyy-->

      </z:zwierze>
      <z:zwierze idG="01" idWybiegu="W09" class="1">
        <z:nazwaZwierzecia >Lew</z:nazwaZwierzecia> <!--nazwa może zawierać 40 znaków  -->
        <z:imie >Daro</z:imie><!--Imie zaczyna się wielką literą i może zaiwerać max 15 znaków-->
        <z:wiek>7</z:wiek><!-- liczba całkowita -->
        <z:waga jednostka="kg">650.0</z:waga><!--liczba zmiennoprzecinowa. Reprezentacja w jednostce kg -->
        <z:zdjecie src="./Photos/Animals/Stefan" format="JPEG"/><!--zdjęcie musi byc zapisane pod podaną ścieżką w formacie JPEG-->
        <z:dataUrodzenia>02.09.2016</z:dataUrodzenia><!-- data w formacie dd.mm.yyyy-->

      </z:zwierze>
      <z:zwierze idG="01" idWybiegu="W10" class="2">
        <z:nazwaZwierzecia >Tygrys</z:nazwaZwierzecia> <!--nazwa może zawierać 40 znaków  -->
        <z:imie >Michał</z:imie><!--Imie zaczyna się wielką literą i może zaiwerać max 15 znaków-->
        <z:wiek>10</z:wiek><!-- liczba całkowita -->
        <z:waga jednostka="kg">700.0</z:waga><!--liczba zmiennoprzecinowa. Reprezentacja w jednostce kg -->
        <z:zdjecie src="./Photos/Animals/Stefan" format="JPEG"/><!--zdjęcie musi byc zapisane pod podaną ścieżką w formacie JPEG-->
        <z:dataUrodzenia>14.02.2012</z:dataUrodzenia><!-- data w formacie dd.mm.yyyy-->

      </z:zwierze>
      <z:zwierze idG="01" idWybiegu="W11" class="3">
        <z:nazwaZwierzecia >Kapucynka</z:nazwaZwierzecia> <!--nazwa może zawierać 40 znaków  -->
        <z:imie >Stefcia</z:imie><!--Imie zaczyna się wielką literą i może zaiwerać max 15 znaków-->
        <z:wiek>3</z:wiek><!-- liczba całkowita -->
        <z:waga jednostka="kg">30.0</z:waga><!--liczba zmiennoprzecinowa. Reprezentacja w jednostce kg -->
        <z:zdjecie src="./Photos/Animals/Stefan" format="JPEG"/><!--zdjęcie musi byc zapisane pod podaną ścieżką w formacie JPEG-->
        <z:dataUrodzenia>12.05.2019</z:dataUrodzenia><!-- data w formacie dd.mm.yyyy-->

      </z:zwierze>
      <z:zwierze idG="04" idWybiegu="W12" class="4">
        <z:nazwaZwierzecia >Pirania</z:nazwaZwierzecia> <!--nazwa może zawierać 40 znaków  -->
        <z:imie >Ada</z:imie><!--Imie zaczyna się wielką literą i może zaiwerać max 15 znaków-->
        <z:wiek>2</z:wiek><!-- liczba całkowita -->
        <z:waga jednostka="kg">0.7</z:waga><!--liczba zmiennoprzecinowa. Reprezentacja w jednostce kg -->
        <z:zdjecie src="./Photos/Animals/Stefan" format="JPEG"/><!--zdjęcie musi byc zapisane pod podaną ścieżką w formacie JPEG-->
        <z:dataUrodzenia>26.05.2020</z:dataUrodzenia><!-- data w formacie dd.mm.yyyy-->

      </z:zwierze>
      <z:zwierze idG="01" idWybiegu="W13" class="1">
        <z:nazwaZwierzecia >Koza</z:nazwaZwierzecia> <!--nazwa może zawierać 40 znaków  -->
        <z:imie >Adrian</z:imie><!--Imie zaczyna się wielką literą i może zaiwerać max 15 znaków-->
        <z:wiek>5</z:wiek><!-- liczba całkowita -->
        <z:waga jednostka="kg">150.0</z:waga><!--liczba zmiennoprzecinowa. Reprezentacja w jednostce kg -->
        <z:zdjecie src="./Photos/Animals/Stefan" format="JPEG"/><!--zdjęcie musi byc zapisane pod podaną ścieżką w formacie JPEG-->
        <z:dataUrodzenia>11.11.2017</z:dataUrodzenia><!-- data w formacie dd.mm.yyyy-->

      </z:zwierze>
      <z:zwierze idG="05" idWybiegu="W14" class="2">
        <z:nazwaZwierzecia >Paw</z:nazwaZwierzecia> <!--nazwa może zawierać 40 znaków  -->
        <z:imie >Burek</z:imie><!--Imie zaczyna się wielką literą i może zaiwerać max 15 znaków-->
        <z:wiek>3</z:wiek><!-- liczba całkowita -->
        <z:waga jednostka="kg">50.0</z:waga><!--liczba zmiennoprzecinowa. Reprezentacja w jednostce kg -->
        <z:zdjecie src="./Photos/Animals/Stefan" format="JPEG"/><!--zdjęcie musi byc zapisane pod podaną ścieżką w formacie JPEG-->
        <z:dataUrodzenia>12.05.2019</z:dataUrodzenia><!-- data w formacie dd.mm.yyyy-->

      </z:zwierze>
      <z:zwierze idG="05" idWybiegu="W15" class="3">
        <z:nazwaZwierzecia >Bażant</z:nazwaZwierzecia> <!--nazwa może zawierać 40 znaków  -->
        <z:imie >Beza</z:imie><!--Imie zaczyna się wielką literą i może zaiwerać max 15 znaków-->
        <z:wiek>12</z:wiek><!-- liczba całkowita -->
        <z:waga jednostka="kg">12.0</z:waga><!--liczba zmiennoprzecinowa. Reprezentacja w jednostce kg -->